{
  "$schema": "https://json-schema.org/draft/2020-12/schema",
  "$id": "https://dbyr.example/schema/0.1.0/system_runtime_record.schema.json",
  "title": "SystemRuntimeRecord",
  "description": "Filed before a system built on a covered run's model is deployed internally at scale or exposed externally. It records the deployment's own advance commitments: how it is watched, what pauses it, who decides, and what evidence is kept. Incidents after deployment are reported in ExceptionNotices and Closeouts that name the system_id.",
  "type": "object",
  "additionalProperties": false,
  "required": [
    "schema_version",
    "record_type",
    "system_id",
    "filed_at",
    "base_run_ids",
    "deployment_context",
    "inter_agent_comms_permitted",
    "signer",
    "deployment_window",
    "roles",
    "monitoring_instruments",
    "pause_criteria",
    "restart_protocol",
    "log_retention"
  ],
  "properties": {
    "schema_version": {
      "$ref": "common.schema.json#/$defs/schema_version",
      "description": "The schema version the filing is written against."
    },
    "record_type": {
      "const": "SystemRuntimeRecord",
      "description": "The record type. It fixes which schema and which checks apply."
    },
    "system_id": {
      "$ref": "common.schema.json#/$defs/id",
      "x-tier": "public",
      "description": "Identifier of the deployed system."
    },
    "filed_at": {
      "$ref": "common.schema.json#/$defs/timestamp",
      "x-tier": "public",
      "description": "When the record was filed: before deployment_window.start. A later filing is a conduct finding."
    },
    "base_run_ids": {
      "type": "array",
      "minItems": 1,
      "items": {
        "$ref": "common.schema.json#/$defs/id"
      },
      "x-tier": "public",
      "description": "The runs whose models the system is built on. Each must have an Intent on record, and its latest Closeout before deployment must clear it for system integration."
    },
    "deployment_context": {
      "enum": [
        "internal_research",
        "internal_production",
        "external"
      ],
      "x-tier": "public",
      "description": "Where the system runs: internal research, internal production, or external use."
    },
    "tools_and_scaffolding": {
      "type": "array",
      "items": {
        "type": "string"
      },
      "x-tier": "restricted",
      "description": "The tools and scaffolding the system gives the model. A tool no base run's agent_capabilities included is a warning: the run's monitoring never saw it in use."
    },
    "inference_scaling": {
      "type": "string",
      "x-tier": "restricted",
      "description": "How much inference compute the system can use, and how it scales."
    },
    "inter_agent_comms_permitted": {
      "type": "boolean",
      "x-tier": "public",
      "description": "Whether instances of the system can read each other's output."
    },
    "user_exposure": {
      "type": "string",
      "x-tier": "restricted",
      "description": "Who uses the system, and how many. Required for an external deployment."
    },
    "oversight_mode": {
      "type": "string",
      "x-tier": "restricted",
      "description": "How people oversee the system in operation. Required for an external deployment."
    },
    "recurring_eval_cadence": {
      "type": "string",
      "x-tier": "restricted",
      "description": "How often the system is re-evaluated. Required for an external deployment."
    },
    "deployment_window": {
      "$ref": "common.schema.json#/$defs/window",
      "x-tier": "public",
      "description": "When the system is deployed. A null end means it stays deployed; Closeouts for the system are then due every 30 days."
    },
    "roles": {
      "$ref": "training_run_intent.schema.json#/properties/roles",
      "description": "Every role this record and the system's later filings name. Titles are public; contacts restricted; identities sealed."
    },
    "monitoring_instruments": {
      "$ref": "training_run_intent.schema.json#/properties/monitoring_instruments",
      "x-tier": "restricted",
      "description": "How the deployed system is watched. An empty array is a declared absence of monitoring."
    },
    "pause_criteria": {
      "$ref": "training_run_intent.schema.json#/properties/pause_criteria",
      "x-tier": "restricted",
      "description": "Events that pause or withdraw the deployed system, who decides, and what must be done."
    },
    "restart_protocol": {
      "$ref": "training_run_intent.schema.json#/properties/restart_protocol",
      "x-tier": "restricted",
      "description": "How a paused system is restored to service."
    },
    "log_retention": {
      "$ref": "training_run_intent.schema.json#/properties/log_retention",
      "x-tier": "public",
      "description": "What evidence from the deployment is kept, for how long, and how it is reviewed."
    },
    "signer": {
      "$ref": "common.schema.json#/$defs/signer",
      "x-tier": "public",
      "description": "Who signs the filing."
    }
  }
}
