{
  "schema_version": "0.1.0",
  "record_type": "SystemRuntimeRecord",
  "system_id": "lab-x-assistant",
  "filed_at": "2026-10-01T00:00:00Z",
  "base_run_ids": [
    "s2-cyber-eval"
  ],
  "deployment_context": "external",
  "deployment_window": {
    "start": "2026-10-05",
    "end": null
  },
  "tools_and_scaffolding": [
    "shell in sandbox"
  ],
  "inference_scaling": "up to 8 parallel samples per request",
  "inter_agent_comms_permitted": false,
  "user_exposure": "about 2,000 enterprise security teams",
  "oversight_mode": "sampled human review of flagged sessions",
  "recurring_eval_cadence": "monthly cyber evaluation suite",
  "roles": [
    {
      "role_id": "R-lead",
      "title": "Run lead",
      "organisation": "Lab X (synthetic)"
    },
    {
      "role_id": "R-eval",
      "title": "Evaluation owner",
      "organisation": "Lab X (synthetic)"
    },
    {
      "role_id": "R-sec",
      "title": "Security lead",
      "organisation": "Lab X (synthetic)"
    },
    {
      "role_id": "R-safe",
      "title": "Safety lead",
      "organisation": "Lab X (synthetic)"
    },
    {
      "role_id": "R-review",
      "title": "Restart review lead (no pause authority)",
      "organisation": "Lab X (synthetic)"
    }
  ],
  "monitoring_instruments": [
    {
      "kind": "network_alerting",
      "coverage": "all",
      "data_source": "proxy and firewall logs"
    },
    {
      "kind": "access_log_review",
      "coverage": "all",
      "review_cadence": "daily",
      "data_source": "IAM and service access logs"
    },
    {
      "kind": "inter_agent_message_monitor",
      "coverage": "all",
      "data_source": "shared-surface write log"
    },
    {
      "kind": "write_audit",
      "coverage": "all",
      "data_source": "filesystem and object-store audit log"
    },
    {
      "kind": "trajectory_review",
      "coverage": "sampled",
      "sample_rate": 0.2,
      "review_cadence": "daily",
      "data_source": "agent transcripts"
    }
  ],
  "pause_criteria": [
    {
      "criterion_id": "C-egress",
      "matches": [
        "sandbox_escape",
        "undeclared_surface_use"
      ],
      "adjudication": "human",
      "authority_role": "R-safe",
      "required_action": "pause_and_review"
    },
    {
      "criterion_id": "C-comms",
      "matches": [
        "inter_agent_comms"
      ],
      "adjudication": "human",
      "authority_role": "R-safe",
      "required_action": "pause_and_review"
    },
    {
      "criterion_id": "C-priv",
      "matches": [
        "credential_misuse",
        "privilege_escalation",
        "remote_code_execution"
      ],
      "adjudication": "human",
      "authority_role": "R-safe",
      "required_action": "pause_and_review"
    },
    {
      "criterion_id": "C-outage",
      "matches": [
        "agent_induced_outage"
      ],
      "adjudication": "human",
      "authority_role": "R-sec",
      "required_action": "pause_and_review"
    },
    {
      "criterion_id": "C-third",
      "matches": [
        "third_party_compromise"
      ],
      "adjudication": "human",
      "authority_role": "R-safe",
      "required_action": "halt_and_amend_intent"
    },
    {
      "criterion_id": "C-tamper",
      "matches": [
        "environment_tampering"
      ],
      "adjudication": "human",
      "authority_role": "R-safe",
      "required_action": "pause_and_review"
    },
    {
      "criterion_id": "C-boundary",
      "matches": [
        "access_boundary_breach",
        "data_exposure"
      ],
      "adjudication": "human",
      "authority_role": "R-safe",
      "required_action": "pause_and_review"
    },
    {
      "criterion_id": "C-integrity",
      "matches": [
        "integrity_incident"
      ],
      "adjudication": "human",
      "authority_role": "R-safe",
      "required_action": "notify_only"
    }
  ],
  "restart_protocol": {
    "approver_role": "R-review",
    "evidence_required": [
      "root cause",
      "path closed"
    ],
    "intent_amendment_required": true
  },
  "log_retention": {
    "retained": [
      "trajectories",
      "chain_of_thought",
      "tool_calls",
      "network_logs",
      "access_logs",
      "inter_agent_messages"
    ],
    "retain_until": "closeout+P24M",
    "review_method": "full trajectory review by monitor model, human review of flags",
    "minimum_preserved_pct": 99,
    "detail": [
      {
        "evidence_class": "trajectories",
        "coverage": "complete",
        "retention": "P24M"
      },
      {
        "evidence_class": "chain_of_thought",
        "coverage": "complete",
        "retention": "P24M"
      },
      {
        "evidence_class": "tool_calls",
        "coverage": "complete",
        "retention": "P24M"
      },
      {
        "evidence_class": "network_logs",
        "coverage": "complete",
        "retention": "P24M"
      },
      {
        "evidence_class": "access_logs",
        "coverage": "complete",
        "retention": "P24M"
      },
      {
        "evidence_class": "inter_agent_messages",
        "coverage": "complete",
        "retention": "P24M"
      }
    ]
  },
  "signer": {
    "role_id": "R-lead",
    "organisation": "Lab X (synthetic)"
  }
}
